{
  "service": "runtime-egress",
  "status": "enforced",
  "implementation_issues": [
    32
  ],
  "routes": {
    "GET /internal/agent-networks/{agent_id}": {
      "callers": [
        "agent-controller"
      ],
      "authentication": "workload",
      "caller_context": {
        "agent-controller": "operation"
      },
      "request_body": "none"
    },
    "GET /internal/agent-policy-assignments/{agent_id}": {
      "callers": [
        "agent-controller"
      ],
      "authentication": "workload",
      "caller_context": {
        "agent-controller": "operation"
      },
      "request_body": "none"
    },
    "GET /internal/policies/{policy_id}/revisions/{revision}": {
      "callers": [
        "agent-controller"
      ],
      "authentication": "workload",
      "caller_context": {
        "agent-controller": "operation"
      },
      "request_body": "none"
    },
    "GET /status": {
      "callers": [
        "local-healthcheck"
      ],
      "authentication": "health",
      "caller_context": {
        "local-healthcheck": "none"
      },
      "request_body": "none"
    },
    "POST /internal/agent-networks/{agent_id}/release": {
      "callers": [
        "agent-controller"
      ],
      "authentication": "workload",
      "caller_context": {
        "agent-controller": "operation"
      },
      "request_body": "json"
    },
    "PUT /internal/agent-network-attachments/{agent_id}": {
      "callers": [
        "agent-controller"
      ],
      "authentication": "workload",
      "caller_context": {
        "agent-controller": "operation"
      },
      "request_body": "json"
    },
    "PUT /internal/agent-networks/{agent_id}": {
      "callers": [
        "agent-controller"
      ],
      "authentication": "workload",
      "caller_context": {
        "agent-controller": "operation"
      },
      "request_body": "none"
    },
    "PUT /internal/agent-policy-assignments/{agent_id}": {
      "callers": [
        "agent-controller"
      ],
      "authentication": "workload",
      "caller_context": {
        "agent-controller": "operation"
      },
      "request_body": "json"
    },
    "PUT /internal/agent-tunnel-keys/{agent_id}": {
      "callers": [
        "runtime-controller"
      ],
      "authentication": "workload",
      "caller_context": {
        "runtime-controller": "operation"
      },
      "request_body": "json"
    },
    "PUT /internal/policies/{policy_id}/revisions/{revision}": {
      "callers": [
        "agent-controller"
      ],
      "authentication": "workload",
      "caller_context": {
        "agent-controller": "operation"
      },
      "request_body": "json"
    }
  },
  "guarded_sources": {
    "services/runtime-egress/src/control.rs": {
      "sha256": "bfe87c21c4562469b03418f888dc1200bcee9817682d94f4b665bbb7c7de3a57",
      "routes": [
        "PUT /internal/agent-tunnel-keys/{agent_id}",
        "GET /status",
        "GET /internal/agent-networks/{agent_id}",
        "PUT /internal/agent-networks/{agent_id}",
        "PUT /internal/agent-network-attachments/{agent_id}",
        "POST /internal/agent-networks/{agent_id}/release",
        "GET /internal/policies/{policy_id}/revisions/{revision}",
        "PUT /internal/policies/{policy_id}/revisions/{revision}",
        "GET /internal/agent-policy-assignments/{agent_id}",
        "PUT /internal/agent-policy-assignments/{agent_id}"
      ]
    }
  }
}
