{
  "service": "antnest-runtime",
  "status": "enforced",
  "implementation_issues": [30],
  "routes": {
    "* /mcp": {
      "callers": ["agent-acp-service"],
      "authentication": "workload",
      "caller_context": {
        "agent-acp-service": "operation"
      },
      "request_body": "protocol",
      "notes": "The mounted MCP service dispatches POST JSON RPC (application/json), GET observation and DELETE session requests. Authenticate the complete mount and retain the execution fence; unsupported methods/paths must fail."
    },
    "GET /status": {
      "callers": ["runtime-controller", "agent-acp-service"],
      "authentication": "workload",
      "caller_context": {
        "runtime-controller": "none",
        "agent-acp-service": "none"
      },
      "request_body": "none"
    },
    "POST /internal/skill-maintenance/{action}": {
      "callers": ["agent-acp-service"],
      "authentication": "workload",
      "caller_context": {
        "agent-acp-service": "operation"
      },
      "request_body": "protocol",
      "notes": "Workload proof supplements the signed ticket and execution fence. The install action is a bounded multipart artifact upload; the read-only digest action is a strict application/json query."
    },
    "POST /internal/skill-temporary/{action}": {
      "callers": ["agent-acp-service"],
      "authentication": "workload",
      "caller_context": {
        "agent-acp-service": "operation"
      },
      "request_body": "protocol",
      "notes": "Workload proof supplements the signed ticket and execution fence. The install action is a bounded multipart artifact upload; release is a strict application/json control."
    },
    "* /mcp/{path...}": {
      "callers": ["agent-acp-service"],
      "authentication": "workload",
      "caller_context": {
        "agent-acp-service": "operation"
      },
      "request_body": "protocol",
      "notes": "The mounted MCP service dispatches POST JSON RPC (application/json), GET observation and DELETE session requests. Authenticate the complete mount and retain the execution fence; unsupported methods/paths must fail."
    },
    "GET /status/live": {
      "callers": ["local-healthcheck"],
      "authentication": "health",
      "caller_context": {
        "local-healthcheck": "none"
      },
      "request_body": "none",
      "notes": "Identity-free status only. All callers may probe this reduced liveness route; it grants no Runtime execution or binding authority."
    },
    "HEAD /status/live": {
      "callers": ["local-healthcheck"],
      "authentication": "health",
      "caller_context": {
        "local-healthcheck": "none"
      },
      "request_body": "none",
      "notes": "Identity-free status only. All callers may probe this reduced liveness route; it grants no Runtime execution or binding authority."
    }
  },
  "guarded_sources": {
    "runtimes/antnest-runtime/src/mcp.rs": {
      "sha256": "679cb2206deb47e05a137dca82554812d1ad88c073528f0d1b768f8f983ae213",
      "routes": [
        "GET /status",
        "* /mcp",
        "POST /internal/skill-maintenance/{action}",
        "* /mcp/{path...}",
        "GET /status/live",
        "HEAD /status/live"
      ]
    },
    "runtimes/antnest-runtime/src/skill_temporary_http.rs": {
      "sha256": "cf5df0292e65cec6d652fb12aaa5fd1a8d1e8c16386c78b8c52a6c06ea71093d",
      "routes": ["POST /internal/skill-temporary/{action}"]
    }
  }
}
