{
  "service": "edge-gateway",
  "status": "enforced",
  "implementation_issues": [26],
  "routes": {
    "* /{path...}": {
      "callers": ["browser"],
      "authentication": "public",
      "caller_context": {
        "browser": "none"
      },
      "request_body": "none"
    },
    "* /api/{path...}": {
      "callers": [],
      "authentication": "deny",
      "caller_context": {},
      "request_body": "none"
    },
    "* /api/admin": {
      "callers": [],
      "authentication": "deny",
      "caller_context": {},
      "request_body": "none"
    },
    "* /api/admin/{path...}": {
      "callers": ["browser"],
      "authentication": "public",
      "caller_context": {
        "browser": "session"
      },
      "request_body": "none"
    },
    "* /api/app/{path...}": {
      "callers": [],
      "authentication": "deny",
      "caller_context": {},
      "request_body": "none"
    },
    "* /api/app/workspace/v1/{path...}": {
      "callers": ["browser"],
      "authentication": "public",
      "caller_context": {
        "browser": "session"
      },
      "request_body": "none"
    },
    "* /protocol/oidc": {
      "callers": [],
      "authentication": "deny",
      "caller_context": {},
      "request_body": "none"
    },
    "* /protocol/oidc/{path...}": {
      "callers": [],
      "authentication": "deny",
      "caller_context": {},
      "request_body": "none"
    },
    "* /scim/v2": {
      "callers": ["scim-client"],
      "authentication": "public",
      "caller_context": {
        "scim-client": "scim-token"
      },
      "request_body": "protocol"
    },
    "* /scim/v2/{path...}": {
      "callers": ["scim-client"],
      "authentication": "public",
      "caller_context": {
        "scim-client": "scim-token"
      },
      "request_body": "protocol"
    },
    "* /workspace": {
      "callers": ["browser"],
      "authentication": "public",
      "caller_context": {
        "browser": "session"
      },
      "request_body": "none"
    },
    "* /workspace/{path...}": {
      "callers": ["browser"],
      "authentication": "public",
      "caller_context": {
        "browser": "session"
      },
      "request_body": "none"
    },
    "DELETE /api/app/agents/{agent_id}/acp": {
      "callers": ["browser"],
      "authentication": "public",
      "caller_context": {
        "browser": "session"
      },
      "request_body": "none"
    },
    "DELETE /api/app/agents/{agent_id}/v1/acp": {
      "callers": ["browser"],
      "authentication": "public",
      "caller_context": {
        "browser": "session"
      },
      "request_body": "none"
    },
    "DELETE /api/session": {
      "callers": ["browser"],
      "authentication": "public",
      "caller_context": {
        "browser": "session"
      },
      "request_body": "none"
    },
    "GET /api/app/agents/{agent_id}/acp": {
      "callers": ["browser"],
      "authentication": "public",
      "caller_context": {
        "browser": "session"
      },
      "request_body": "none"
    },
    "GET /api/app/agents/{agent_id}/state": {
      "callers": ["browser"],
      "authentication": "public",
      "caller_context": {
        "browser": "session"
      },
      "request_body": "none"
    },
    "GET /api/app/agents/{agent_id}/state/watch": {
      "callers": ["browser"],
      "authentication": "public",
      "caller_context": {
        "browser": "session"
      },
      "request_body": "none"
    },
    "GET /api/app/agents/{agent_id}/v1/acp": {
      "callers": ["browser"],
      "authentication": "public",
      "caller_context": {
        "browser": "session"
      },
      "request_body": "none"
    },
    "GET /api/app/agents/{agent_id}/v2/acp": {
      "callers": ["browser"],
      "authentication": "public",
      "caller_context": {
        "browser": "session"
      },
      "request_body": "none"
    },
    "GET /api/app/bootstrap": {
      "callers": ["browser"],
      "authentication": "public",
      "caller_context": {
        "browser": "session"
      },
      "request_body": "none"
    },
    "GET /api/session": {
      "callers": ["browser"],
      "authentication": "public",
      "caller_context": {
        "browser": "session"
      },
      "request_body": "none"
    },
    "GET /api/session/account": {
      "callers": ["browser"],
      "authentication": "public",
      "caller_context": {
        "browser": "session"
      },
      "request_body": "none"
    },
    "GET /api/session/sessions": {
      "callers": ["browser"],
      "authentication": "public",
      "caller_context": {
        "browser": "session"
      },
      "request_body": "none"
    },
    "GET /protocol/oidc/callback": {
      "callers": ["browser"],
      "authentication": "public",
      "caller_context": {
        "browser": "none"
      },
      "request_body": "none"
    },
    "GET /status": {
      "callers": ["local-healthcheck"],
      "authentication": "health",
      "caller_context": {
        "local-healthcheck": "none"
      },
      "request_body": "none"
    },
    "POST /api/app/agents/{agent_id}/acp": {
      "callers": ["browser"],
      "authentication": "public",
      "caller_context": {
        "browser": "session"
      },
      "request_body": "json"
    },
    "POST /api/app/agents/{agent_id}/v1/acp": {
      "callers": ["browser"],
      "authentication": "public",
      "caller_context": {
        "browser": "session"
      },
      "request_body": "json"
    },
    "POST /api/session/activity": {
      "callers": ["browser"],
      "authentication": "public",
      "caller_context": {
        "browser": "session"
      },
      "request_body": "json"
    },
    "POST /api/session/login": {
      "callers": ["browser"],
      "authentication": "public",
      "caller_context": {
        "browser": "none"
      },
      "request_body": "json"
    },
    "POST /api/session/login-methods": {
      "callers": ["browser"],
      "authentication": "public",
      "caller_context": {
        "browser": "none"
      },
      "request_body": "json"
    },
    "POST /api/session/oidc/start": {
      "callers": ["browser"],
      "authentication": "public",
      "caller_context": {
        "browser": "none"
      },
      "request_body": "json"
    },
    "POST /api/session/password": {
      "callers": ["browser"],
      "authentication": "public",
      "caller_context": {
        "browser": "session"
      },
      "request_body": "json"
    },
    "POST /api/session/sessions/revoke": {
      "callers": ["browser"],
      "authentication": "public",
      "caller_context": {
        "browser": "session"
      },
      "request_body": "json"
    }
  },
  "guarded_sources": {}
}
